{
  "schema": "srp.task.v1",
  "task_id": "task_018f0f4a-5c00-4000-8000-000000000001",
  "revision": 1,
  "state": "open",
  "title": "Reproduce the reference implementation",
  "description": "Run the documented procedure and record outputs.",
  "inputs": [{ "name": "dataset", "description": "Pinned input dataset" }],
  "outputs": [{ "name": "report", "description": "Reproduction report" }],
  "acceptance": ["Commands and versions are recorded"],
  "context_mode": "frontier",
  "created_at": "2026-08-04T06:00:00.000Z",
  "created_by": "actor_01"
}
